{
  "authority_class": "derived",
  "created_or_refreshed_boundary": "sha256:a95e6121c28a27c91977c0a0a3e2ee79f0a5908b563aa826e0827c9c6d406d7e",
  "freshness_basis": "G009_EXACT_INPUTS_AND_GENERATOR_V1",
  "generator": {
    "generator_id": "project_knowledge_source_catalog",
    "generator_version": "1",
    "implementation_basis": "GIT_BLOB_BYTES_AT_COMMIT",
    "implementation_digest": "8eee8b2003124cf7e0033abeac9d61f8deeacd947c0ac26ccf9145f18b416318",
    "implementation_files": [
      "tools/project_knowledge/model.py",
      "tools/project_knowledge/views.py",
      "tools/project_knowledge/services/generation.py",
      "tools/project_knowledge/services/validation.py",
      "tools/project_knowledge/services/discovery.py",
      "tools/project_knowledge/adapters/gitio.py",
      "tools/project_knowledge/adapters/fsio.py",
      "tools/project_knowledge/adapters/schema.py",
      "tools/project_knowledge/declaration.py",
      "tools/project_knowledge/references.py",
      "schemas/project_knowledge/defs.v1.schema.json",
      "schemas/project_knowledge/semantic_source.v1.schema.json",
      "schemas/project_knowledge/workstream.v1.schema.json",
      "schemas/project_knowledge/governing_procedure.v1.schema.json",
      "schemas/project_knowledge/project_boundary.v1.schema.json",
      "schemas/project_knowledge/identity_transition.v1.schema.json",
      "schemas/project_knowledge/joint_authority.v1.schema.json",
      "schemas/project_knowledge/capture.v1.schema.json",
      "schemas/project_knowledge/derived_view_manifest.v1.schema.json",
      "tools/project_knowledge/__init__.py",
      "tools/project_knowledge/adapters/__init__.py",
      "tools/project_knowledge/services/__init__.py",
      "tools/project_knowledge/adapters/execution.py",
      "tools/project_knowledge/adapters/pure.py",
      "tools/project_knowledge/view_definitions/common.py",
      "tools/project_knowledge/view_definitions/source_catalog.py",
      "tools/project_knowledge/view_definitions/units_normalized_scope.py",
      "tools/project_knowledge/view_definitions/units_unique_values.py",
      "tools/project_knowledge/pure_source_catalog.py",
      "tools/project_knowledge/pure_normalized_scope.py",
      "tools/project_knowledge/pure_unique_values.py"
    ]
  },
  "input_bindings": [
    {
      "content_digest": "8111fb7631c1e931b223645b8b755c1b97f54cc31434dcf4e14a0fe917edeef7",
      "hash_algorithm": "sha256",
      "hash_basis": "GIT_BLOB_BYTES_AT_COMMIT",
      "semantic_id": "D-035",
      "source_path": "docs/DECISIONS.md"
    },
    {
      "content_digest": "d39bf8ef85d714c12de23ee3ee48f626febc53a214805effca0b5812f6280970",
      "hash_algorithm": "sha256",
      "hash_basis": "GIT_BLOB_BYTES_AT_COMMIT",
      "semantic_id": "EXPERIMENT:192",
      "source_path": "docs/checkpoints/192_specification_022_incomplete_result_preservation_promotion_candidate.md"
    },
    {
      "content_digest": "74e919bc8a3f817d08a82d8d523cb9656d310af9873bd31b39b8b9f1ffb46b69",
      "hash_algorithm": "sha256",
      "hash_basis": "GIT_BLOB_BYTES_AT_COMMIT",
      "semantic_id": "COCKPIT:DESIGN-EXPLORATION-RESUME",
      "source_path": "docs/cockpit/COCKPIT_DESIGN_RESUME_TARGET.md"
    },
    {
      "content_digest": "08726acc6541e23fa568d1b444f98124456ac5863fc263498af5e5115f8a90c3",
      "hash_algorithm": "sha256",
      "hash_basis": "GIT_BLOB_BYTES_AT_COMMIT",
      "semantic_id": "WS-COCKPIT-DESIGN",
      "source_path": "docs/cockpit/README.md"
    },
    {
      "content_digest": "a06d2734d4ff8298f60ed52aa5ff02a9a373c4a02937a8e3d7ba4a01b2993549",
      "hash_algorithm": "sha256",
      "hash_basis": "GIT_BLOB_BYTES_AT_COMMIT",
      "semantic_id": "PROJECT-INTEGRATION-BOUNDARY",
      "source_path": "docs/project_knowledge/project_integration_boundary.md"
    },
    {
      "content_digest": "04ea61adbe98533badfeda1fa676bba78241060f0a4a1d363410fb932d006784",
      "hash_algorithm": "sha256",
      "hash_basis": "GIT_BLOB_BYTES_AT_COMMIT",
      "semantic_id": "WS-PKA-CURRENT",
      "source_path": "docs/project_knowledge/selected_architecture_workstream.md"
    },
    {
      "content_digest": "4cf4205cd5f800a43ab32f74db3b3f4c557f6f9bf65e97c6dbbb98f214f413bf",
      "hash_algorithm": "sha256",
      "hash_basis": "GIT_BLOB_BYTES_AT_COMMIT",
      "semantic_id": "PROCEDURE:PERMANENT-SOURCE-VAULT-BOOTSTRAP",
      "source_path": "docs/source_universe/PERMANENT_VAULT_BOOTSTRAP.md"
    },
    {
      "content_digest": "8af6602abbc25ff7eac8d8021239841231b32d28fe0880c859b3be2a7c30ea2a",
      "hash_algorithm": "sha256",
      "hash_basis": "GIT_BLOB_BYTES_AT_COMMIT",
      "semantic_id": "WS-SOURCE-VAULT-BOOTSTRAP",
      "source_path": "docs/source_universe/SOURCE_VAULT_BOOTSTRAP_WORKSTREAM.md"
    },
    {
      "content_digest": "8e5515bbdab42fe1ba9de7bd374207ebadc26e89cddcd8085ad7962495f3eeea",
      "hash_algorithm": "sha256",
      "hash_basis": "GIT_BLOB_BYTES_AT_COMMIT",
      "semantic_id": "SOURCE-VAULT:REVIEWED-INGESTION",
      "source_path": "docs/source_universe/SOURCE_VAULT_REVIEWED_INGESTION.md"
    },
    {
      "content_digest": "7651707b5d590efd7686a77dca20597dc731bfafa1fabc2358775bef7b9d2ffe",
      "hash_algorithm": "sha256",
      "hash_basis": "GIT_BLOB_BYTES_AT_COMMIT",
      "semantic_id": "SPECIFICATION:028",
      "source_path": "docs/specifications/028_v1_project_knowledge_architecture_implementation_and_migration_contract.md"
    }
  ],
  "kind": "derived_view_manifest",
  "profile": "derived_view_manifest.v1",
  "rebuildability_class": "DETERMINISTIC_BYTE_REBUILD",
  "schema_version": "1",
  "snapshot_mode": "COMMIT_SNAPSHOT",
  "snapshot_status": "COMMITTED",
  "view_id": "source_catalog",
  "view_path": "docs/project_knowledge/generated/source_catalog.json",
  "view_schema_version": "1"
}
